{
  "$schema": "https://json-schema.org/draft/2020-12/schema",
  "title": "Proposed judgment",
  "type": "object",
  "additionalProperties": false,
  "required": [
    "criterion_id",
    "status",
    "reason",
    "evidence",
    "model",
    "usage"
  ],
  "properties": {
    "criterion_id": {
      "type": "string",
      "minLength": 1
    },
    "status": {
      "enum": [
        "pass",
        "fail",
        "unverifiable"
      ]
    },
    "reason": {
      "type": "string",
      "minLength": 1
    },
    "evidence": {
      "type": "string",
      "minLength": 1
    },
    "model": {
      "type": "string",
      "minLength": 1
    },
    "usage": {
      "$ref": "#/$defs/usage"
    }
  },
  "$defs": {
    "usage": {
      "type": "object",
      "additionalProperties": false,
      "required": [
        "input_tokens",
        "cached_input_tokens",
        "output_tokens",
        "usd",
        "latency_seconds",
        "cost_basis",
        "pricing_ref"
      ],
      "properties": {
        "input_tokens": {
          "type": [
            "integer",
            "null"
          ],
          "minimum": 0
        },
        "cached_input_tokens": {
          "type": [
            "integer",
            "null"
          ],
          "minimum": 0
        },
        "output_tokens": {
          "type": [
            "integer",
            "null"
          ],
          "minimum": 0
        },
        "usd": {
          "type": [
            "number",
            "null"
          ],
          "minimum": 0
        },
        "latency_seconds": {
          "type": "number",
          "minimum": 0
        },
        "cost_basis": {
          "const": "api_equivalent_usd"
        },
        "pricing_ref": {
          "type": [
            "string",
            "null"
          ],
          "minLength": 1
        }
      }
    }
  }
}
